{
  "schemaVersion": 1,
  "id": "debug-di-001",
  "version": 1,
  "title": "Identifier un mauvais enregistrement DI",
  "difficulty": 3,
  "skills": ["debugging.di", "csharp.interfaces"],
  "prerequisites": ["reference-types-001"],
  "estimatedMinutes": 45,
  "brokenRepositoryPath": "broken/",
  "ticketPath": "ticket.md",
  "expectedBehavior": "Le service de salutation français doit être résolu pour produire Bonjour suivi du nom normalisé, sans dépendre d'un conteneur externe.",
  "logsPath": "logs.txt",
  "checklist": ["Reproduire la résolution du service", "Observer le type concret résolu", "Comparer interface et enregistrement", "Tester plusieurs noms"],
  "observationQuestions": ["Quel type concret est construit pour l'interface ?", "L'appelant ou l'enregistrement porte-t-il la faute ?", "Quel test révèle une substitution d'implémentation ?"],
  "correctionPath": "correction/",
  "regressionTestPath": "regression-test.md",
  "journalFields": ["symptom", "context", "hypotheses", "evidence", "cause", "fix", "test", "prevention"],
  "license": "CC-BY-4.0"
}
