{
  "schemaVersion": 1,
  "id": "front-blazor-render-debug-001",
  "version": 1,
  "title": "Rafraichir un parametre Blazor perime",
  "difficulty": 3,
  "skills": ["debugging.breakpoints", "debugging.data"],
  "prerequisites": ["reference-types-001"],
  "estimatedMinutes": 40,
  "brokenRepositoryPath": "broken/",
  "ticketPath": "ticket.md",
  "expectedBehavior": "L'etiquette derivee du composant doit refleter la derniere valeur recue par son parametre : apres plusieurs mises a jour, la valeur affichee doit etre total: suivi de la derniere valeur, jamais de la premiere.",
  "logsPath": "logs.txt",
  "checklist": [
    "Reproduire en mettant a jour le parametre plusieurs fois de suite",
    "Placer un point d'arret la ou l'etiquette est construite",
    "Comparer la valeur affichee a la derniere valeur recue",
    "Ajouter un cas de non-regression ou la valeur change apres le premier rendu"
  ],
  "observationQuestions": [
    "Quelle valeur du parametre l'etiquette montre-t-elle apres la troisieme mise a jour ?",
    "A quel moment du cycle de rendu l'etiquette est-elle construite une seule fois ?",
    "Dans la pile d'appels, quelle etape de mise a jour ne recalcule pas l'etiquette ?",
    "En variable locale, la valeur retenue suit-elle la derniere entree ou la premiere ?"
  ],
  "correctionPath": "correction/",
  "regressionTestPath": "regression-test.md",
  "journalFields": ["symptom", "context", "hypotheses", "evidence", "cause", "fix", "test", "prevention"],
  "license": "CC-BY-4.0"
}
