{
  "schemaVersion": 1,
  "id": "debug-loop-001",
  "version": 1,
  "title": "Détecter un dépassement de boucle",
  "difficulty": 2,
  "skills": ["debugging.loop", "csharp.arrays"],
  "prerequisites": ["reference-types-001"],
  "estimatedMinutes": 35,
  "brokenRepositoryPath": "broken/",
  "ticketPath": "ticket.md",
  "expectedBehavior": "La recherche retourne l'index de la première occurrence ou -1 lorsque la valeur est absente, y compris pour un tableau vide.",
  "logsPath": "logs.txt",
  "checklist": ["Reproduire avec une valeur absente", "Observer l'index à chaque itération", "Comparer index et longueur", "Tester un tableau vide"],
  "observationQuestions": ["Quelle valeur prend l'index juste avant l'exception ?", "Quel opérateur autorise une itération de trop ?", "Pourquoi un cas présent peut-il masquer le défaut ?"],
  "correctionPath": "correction/",
  "regressionTestPath": "regression-test.md",
  "journalFields": ["symptom", "context", "hypotheses", "evidence", "cause", "fix", "test", "prevention"],
  "license": "CC-BY-4.0"
}
