{
    "schemaVersion":  1,
    "id":  "debug-duplicate-count-001",
    "version":  1,
    "title":  "Doublons comptés deux fois",
    "difficulty":  3,
    "skills":  [
                   "debugging.data"
               ],
    "prerequisites":  [
                          "algo-reformulation-complexity-001"
                      ],
    "estimatedMinutes":  40,
    "brokenRepositoryPath":  "broken/",
    "ticketPath":  "ticket.md",
    "expectedBehavior":  "Le résultat doit respecter tous les cas du contrat sans mutation cachée. La double boucle compte des paires au lieu des valeurs distinctes.",
    "logsPath":  "logs.txt",
    "checklist":  [
                      "Reproduire avec le cas de borne",
                      "Placer un breakpoint avant la divergence",
                      "Comparer entrée et valeur intermédiaire",
                      "Ajouter le cas de non-régression"
                  ],
    "observationQuestions":  [
                                 "Quelle est la première valeur qui diverge du résultat prédit ?",
                                 "Quelle condition ou mutation explique causalement ce symptôme ?"
                             ],
    "correctionPath":  "correction/",
    "regressionTestPath":  "regression-test.md",
    "journalFields":  [
                          "symptom",
                          "context",
                          "hypotheses",
                          "evidence",
                          "cause",
                          "fix",
                          "test",
                          "prevention"
                      ],
    "license":  "CC-BY-4.0"
}
